{
  "format": "vcpu8-fixture/1",
  "isaVersion": "1.0.0",
  "name": "example-14-fibonacci",
  "kind": "example",
  "description": "Iterate F(n+2) = F(n) + F(n+1), keeping two terms in registers and writing each term through a pointer.",
  "source": "; 14-fibonacci.asm — the first ten Fibonacci numbers\n;\n; Purpose:  Iterate F(n+2) = F(n) + F(n+1), keeping two terms in registers and writing\n;           each term through a pointer.\n; Expected: mem[0x80..0x89] = 00 01 01 02 03 05 08 0D 15 22\n;           (0, 1, 1, 2, 3, 5, 8, 13, 21, 34).\n;           R0 = F(10) = 55 (0x37), R1 = F(11) = 89 (0x59), R2 = 0x8A, R3 = 0, R4 = 89.\n;           Final FLAGS: Z=1 N=0 V=0 from the last DEC; C=0 from the last ADD (34 + 55).\n; Overflow: none here. F(13) = 233 is the largest term that fits; F(14) = 377 wraps to\n;           121 (0x79) with C=1.\n\n        .equ OUT, 0x80\n        .equ COUNT, 10\n\n        LDI R0, 0           ; a = F(n)\n        LDI R1, 1           ; b = F(n+1)\n        LDI R2, OUT         ; output pointer\n        LDI R3, COUNT       ; terms left\nloop:   STORE [R2], R0\n        INC R2\n        MOV R4, R0\n        ADD R4, R1          ; F(n+2) = a + b\n        MOV R0, R1          ; a ← b\n        MOV R1, R4          ; b ← F(n+2)\n        DEC R3\n        JNZ loop\n        HLT\n",
  "initial": {
    "registers": [0, 0, 0, 0, 0, 0, 0, 0],
    "pc": 0,
    "sp": 255,
    "sd": 0,
    "flags": 0,
    "memory": [
      17, 0, 0, 17, 16, 1, 17, 32, 128, 17, 48, 10, 21, 32, 36, 32,
      16, 64, 32, 65, 16, 1, 16, 20, 37, 48, 66, 12, 1, 0, 0, 0,
      0, 0, 0, 0, 0, 0, 0, 0, 0, 0, 0, 0, 0, 0, 0, 0,
      0, 0, 0, 0, 0, 0, 0, 0, 0, 0, 0, 0, 0, 0, 0, 0,
      0, 0, 0, 0, 0, 0, 0, 0, 0, 0, 0, 0, 0, 0, 0, 0,
      0, 0, 0, 0, 0, 0, 0, 0, 0, 0, 0, 0, 0, 0, 0, 0,
      0, 0, 0, 0, 0, 0, 0, 0, 0, 0, 0, 0, 0, 0, 0, 0,
      0, 0, 0, 0, 0, 0, 0, 0, 0, 0, 0, 0, 0, 0, 0, 0,
      0, 0, 0, 0, 0, 0, 0, 0, 0, 0, 0, 0, 0, 0, 0, 0,
      0, 0, 0, 0, 0, 0, 0, 0, 0, 0, 0, 0, 0, 0, 0, 0,
      0, 0, 0, 0, 0, 0, 0, 0, 0, 0, 0, 0, 0, 0, 0, 0,
      0, 0, 0, 0, 0, 0, 0, 0, 0, 0, 0, 0, 0, 0, 0, 0,
      0, 0, 0, 0, 0, 0, 0, 0, 0, 0, 0, 0, 0, 0, 0, 0,
      0, 0, 0, 0, 0, 0, 0, 0, 0, 0, 0, 0, 0, 0, 0, 0,
      0, 0, 0, 0, 0, 0, 0, 0, 0, 0, 0, 0, 0, 0, 0, 0,
      0, 0, 0, 0, 0, 0, 0, 0, 0, 0, 0, 0, 0, 0, 0, 0
    ]
  },
  "maxInstructions": 200,
  "expected": {
    "status": "HALTED",
    "fault": null,
    "instructions": 85,
    "registers": [55, 89, 138, 0, 89, 0, 0, 0],
    "pc": 28,
    "sp": 255,
    "sd": 0,
    "flags": 8,
    "memory": [
      17, 0, 0, 17, 16, 1, 17, 32, 128, 17, 48, 10, 21, 32, 36, 32,
      16, 64, 32, 65, 16, 1, 16, 20, 37, 48, 66, 12, 1, 0, 0, 0,
      0, 0, 0, 0, 0, 0, 0, 0, 0, 0, 0, 0, 0, 0, 0, 0,
      0, 0, 0, 0, 0, 0, 0, 0, 0, 0, 0, 0, 0, 0, 0, 0,
      0, 0, 0, 0, 0, 0, 0, 0, 0, 0, 0, 0, 0, 0, 0, 0,
      0, 0, 0, 0, 0, 0, 0, 0, 0, 0, 0, 0, 0, 0, 0, 0,
      0, 0, 0, 0, 0, 0, 0, 0, 0, 0, 0, 0, 0, 0, 0, 0,
      0, 0, 0, 0, 0, 0, 0, 0, 0, 0, 0, 0, 0, 0, 0, 0,
      0, 1, 1, 2, 3, 5, 8, 13, 21, 34, 0, 0, 0, 0, 0, 0,
      0, 0, 0, 0, 0, 0, 0, 0, 0, 0, 0, 0, 0, 0, 0, 0,
      0, 0, 0, 0, 0, 0, 0, 0, 0, 0, 0, 0, 0, 0, 0, 0,
      0, 0, 0, 0, 0, 0, 0, 0, 0, 0, 0, 0, 0, 0, 0, 0,
      0, 0, 0, 0, 0, 0, 0, 0, 0, 0, 0, 0, 0, 0, 0, 0,
      0, 0, 0, 0, 0, 0, 0, 0, 0, 0, 0, 0, 0, 0, 0, 0,
      0, 0, 0, 0, 0, 0, 0, 0, 0, 0, 0, 0, 0, 0, 0, 0,
      0, 0, 0, 0, 0, 0, 0, 0, 0, 0, 0, 0, 0, 0, 0, 0
    ]
  }
}
